"The first time that Kotick went down to the sea a wave carried him out beyond his depth, and his big head sank and his little hind flippers flew up exactly as his mother had told him in the song, and if the next wave had not thrown him back again he would have drowned.","[3, 5, 4, 4, 6, 4, 4, 2, 3, 3, 1, 4, 7, 3, 3, 6, 3, 5, 3, 3, 3, 4, 4, 3, 3, 6, 4, 8, 4, 2, 7, 2, 3, 6, 3, 4, 3, 2, 3, 4, 3, 2, 3, 4, 4, 3, 3, 6, 3, 4, 5, 2, 5, 4, 7]",212,"[1, 1, 1, 1, 2, 1, 1, 1, 1, 2, 1, 1, 2, 1, 1, 1, 1, 1, 1, 1, 1, 2, 1, 1, 1, 1, 1, 2, 1, 1, 3, 1, 1, 2, 1, 1, 1, 1, 1, 1, 1, 1, 1, 1, 1, 1, 1, 1, 1, 1, 2, 1, 1, 1, 1]",64,0.00711805555556,18,1,1,4
"After that, he learned to lie in a beach pool and let the wash of the waves just cover him and lift him up while he paddled, but he always kept his eye open for big waves that might hurt.","[5, 4, 2, 7, 2, 3, 2, 1, 5, 4, 3, 3, 3, 4, 2, 3, 5, 4, 5, 3, 3, 4, 3, 2, 5, 2, 7, 3, 2, 6, 4, 3, 3, 4, 3, 3, 5, 4, 5, 4]",145,"[2, 1, 1, 2, 1, 1, 1, 1, 2, 1, 1, 1, 1, 1, 1, 1, 1, 1, 2, 1, 1, 1, 1, 1, 1, 1, 1, 1, 1, 2, 1, 1, 0, 2, 1, 1, 1, 1, 1, 1]",45,0.0,0,1,1,2
"He was two weeks learning to use his flippers; and all that while he floundered in and out of the water, and coughed and grunted and crawled up the beach and took catnaps on the sand, and went back again, until at last he found that he truly belonged to the water.","[2, 3, 3, 5, 8, 2, 3, 3, 8, 3, 3, 4, 5, 2, 10, 2, 3, 3, 2, 3, 5, 3, 7, 3, 7, 3, 7, 2, 3, 5, 3, 4, 7, 2, 3, 4, 3, 4, 4, 5, 5, 2, 4, 2, 5, 4, 2, 5, 8, 2, 3, 5]",208,"[1, 1, 1, 1, 3, 1, 1, 1, 2, 1, 1, 1, 1, 1, 2, 1, 1, 1, 1, 1, 2, 1, 1, 1, 1, 1, 1, 1, 1, 2, 1, 1, 2, 1, 1, 1, 1, 1, 1, 2, 2, 1, 1, 1, 1, 1, 1, 2, 2, 1, 1, 2]",64,0.0,18,1,1,4
"Then you can imagine the times that he had with his companions, ducking under the rollers; or coming in on top of a comber and landing with a swash and a splutter as the big wave went whirling far up the beach; or standing up on his tail and scratching his head as the old people did; or playing ""I'm the King of the Castle"" on slippery, weedy rocks that just stuck out of the wash. Now and then he would see a thin fin, like a big shark's fin, drifting along close to shore, and he knew that that was the Killer Whale, the Grampus, who eats young seals when he can get them; and Kotick would head for the beach like an arrow, and the fin would jig off slowly, as if it were looking for nothing at all.","[4, 3, 3, 7, 3, 5, 4, 2, 3, 4, 3, 10, 7, 5, 3, 7, 2, 6, 2, 2, 3, 2, 1, 6, 3, 7, 4, 1, 5, 3, 1, 8, 2, 3, 3, 4, 4, 8, 3, 2, 3, 5, 2, 8, 2, 2, 3, 4, 3, 10, 3, 4, 2, 3, 3, 6, 3, 2, 7, 1, 2, 3, 4, 2, 3, 6, 2, 8, 5, 5, 4, 4, 5, 3, 2, 3, 4, 3, 3, 4, 2, 5, 3, 1, 4, 3, 4, 1, 3, 5, 2, 3, 8, 5, 5, 2, 5, 3, 2, 4, 4, 4, 3, 3, 6, 5, 3, 7, 3, 4, 5, 5, 4, 2, 3, 3, 4, 3, 6, 5, 4, 3, 3, 5, 4, 2, 5, 3, 3, 3, 5, 3, 3, 6, 2, 2, 2, 4, 7, 3, 7, 2, 3]",545,"[1, 1, 1, 3, 1, 1, 1, 1, 1, 1, 1, 3, 2, 2, 1, 2, 1, 2, 1, 1, 1, 1, 1, 2, 1, 2, 1, 1, 1, 1, 1, 2, 1, 1, 1, 1, 1, 2, 1, 1, 1, 2, 1, 2, 1, 1, 1, 1, 1, 2, 1, 2, 1, 1, 1, 1, 1, 1, 1, 1, 0, 1, 1, 1, 1, 1, 1, 3, 2, 1, 1, 1, 1, 1, 1, 1, 1, 1, 1, 1, 1, 1, 1, 1, 1, 1, 1, 1, 1, 1, 0, 1, 2, 2, 1, 1, 1, 1, 1, 1, 1, 1, 1, 1, 2, 1, 1, 2, 1, 2, 1, 2, 1, 1, 1, 1, 1, 1, 2, 1, 2, 1, 1, 2, 1, 1, 2, 1, 1, 1, 1, 1, 1, 2, 1, 1, 1, 1, 2, 1, 2, 1, 1]",173,0.0125,3,1,1,4
"Late in October the seals began to leave St. Paul's for the deep sea, by families and tribes, and there was no more fighting over the nurseries, and the holluschickie played anywhere they liked.","[4, 2, 7, 3, 5, 5, 2, 5, 2, 4, 2, 3, 3, 4, 3, 2, 8, 3, 6, 3, 5, 3, 2, 4, 8, 4, 3, 9, 3, 3, 13, 6, 8, 4, 5]",156,"[1, 1, 3, 1, 2, 2, 1, 2, 0, 1, 0, 1, 1, 1, 2, 1, 3, 1, 1, 1, 1, 1, 1, 1, 2, 2, 1, 3, 1, 1, 4, 0, 3, 1, 1]",49,0.0125,0,1,1,2
"""Next year,"" said Matkah to Kotick, ""you will be a holluschickie; but this year you must learn how to catch fish.""","[4, 4, 4, 6, 2, 6, 3, 4, 2, 1, 13, 3, 4, 4, 3, 4, 5, 3, 2, 5, 4]",86,"[1, 2, 1, 2, 1, 2, 1, 1, 1, 1, 4, 1, 1, 2, 1, 1, 2, 1, 1, 1, 1]",29,0.0,14,2,2,2
"They set out together across the Pacific, and Matkah showed Kotick how to sleep on his back with his flippers tucked down by his side and his little nose just out of the water.","[4, 3, 3, 8, 6, 3, 7, 3, 6, 6, 6, 3, 2, 5, 2, 3, 4, 4, 3, 8, 6, 4, 2, 3, 4, 3, 3, 6, 4, 4, 3, 2, 3, 5]",141,"[1, 1, 1, 3, 2, 1, 3, 1, 2, 1, 2, 1, 1, 1, 1, 1, 1, 1, 1, 2, 1, 1, 1, 1, 1, 1, 1, 1, 1, 1, 1, 1, 1, 2]",43,-0.114351851852,13,1,1,2
"No cradle is so comfortable as the long, rocking swell of the Pacific.","[2, 6, 2, 2, 11, 2, 3, 4, 7, 5, 2, 3, 7]",56,"[1, 1, 1, 1, 3, 1, 1, 1, 2, 1, 1, 1, 3]",18,0.175,17,2,2,3
"When Kotick felt his skin tingle all over, Matkah told him he was learning the ""feel of the water,"" and that tingly, prickly feelings meant bad weather coming, and he must swim hard and get away.","[4, 6, 4, 3, 4, 6, 3, 4, 6, 4, 3, 2, 3, 8, 3, 4, 2, 3, 5, 3, 4, 6, 7, 8, 5, 3, 7, 6, 3, 2, 4, 4, 4, 3, 3, 4]",153,"[1, 2, 1, 1, 1, 1, 1, 2, 2, 1, 1, 1, 1, 3, 1, 1, 1, 1, 2, 1, 1, 2, 2, 2, 2, 1, 3, 2, 1, 1, 1, 1, 1, 1, 1, 2]",50,-0.495833333333,13,1,1,2
"""In a little time,"" she said, ""you'll know where to swim to, but just now we'll follow Sea Pig, the Porpoise, for he is very wise.""","[2, 1, 6, 4, 3, 4, 3, 3, 4, 5, 2, 4, 2, 3, 4, 3, 2, 3, 6, 3, 3, 3, 8, 3, 2, 2, 4, 4]",96,"[1, 1, 1, 1, 0, 1, 1, 0, 1, 1, 1, 1, 1, 1, 1, 1, 1, 0, 2, 2, 1, 1, 2, 1, 1, 1, 2, 1]",29,0.36125,8,0,0,0
"A school of porpoises were ducking and tearing through the water, and little Kotick followed them as fast as he could.","[1, 6, 2, 9, 4, 7, 3, 7, 7, 3, 5, 3, 6, 6, 8, 4, 2, 4, 2, 2, 5]",96,"[1, 1, 1, 2, 1, 2, 1, 3, 1, 1, 2, 1, 1, 2, 2, 1, 1, 1, 1, 1, 1]",28,0.00625,14,2,2,2
"""How do you know where to go to?""","[3, 2, 3, 4, 5, 2, 2, 2]",23,"[1, 1, 1, 1, 1, 1, 1, 1]",8,0.0,6,2,2,3
he panted.,"[2, 6]",8,"[1, 1]",2,0.0,6,2,2,3
The leader of the school rolled his white eye and ducked under.,"[3, 6, 2, 3, 6, 6, 3, 5, 3, 3, 6, 5]",51,"[1, 3, 1, 1, 1, 1, 1, 1, 0, 1, 1, 2]",14,0.0,1,2,2,3
"""My tail tingles, youngster,"" he said.","[2, 4, 7, 9, 2, 4]",28,"[1, 1, 1, 2, 1, 1]",7,0.0,6,2,2,3
"""That means there's a gale behind me.","[4, 5, 5, 2, 1, 4, 6, 2]",29,"[1, 2, 1, 0, 1, 1, 2, 1]",9,-0.4,4,2,2,1
Come along!,"[4, 5]",9,"[1, 2]",3,0.0,6,2,2,3
"When you're south of the Sticky Water [he meant the Equator] and your tail tingles, that means there's a gale in front of you and you must head north.","[4, 3, 3, 5, 2, 3, 6, 5, 2, 5, 3, 7, 3, 4, 4, 7, 4, 5, 5, 2, 1, 4, 2, 5, 2, 3, 3, 3, 4, 4, 5]",118,"[1, 1, 0, 1, 1, 1, 2, 2, 1, 2, 1, 3, 1, 1, 1, 1, 1, 2, 1, 0, 1, 1, 1, 1, 1, 1, 1, 1, 1, 2, 1]",36,0.0,14,1,1,2
Come along!,"[4, 5]",9,"[1, 2]",3,0.0,6,2,2,3
"The water feels bad here.""","[3, 5, 5, 3, 4]",20,"[1, 2, 1, 1, 1]",6,-0.7,19,2,2,1
"This was one of very many things that Kotick learned, and he was always learning.","[4, 3, 3, 2, 4, 4, 6, 4, 6, 7, 3, 2, 3, 6, 8]",65,"[1, 1, 1, 1, 2, 2, 1, 1, 2, 2, 1, 1, 1, 2, 3]",22,0.65,7,0,0,0
"Matkah taught him to follow the cod and the halibut along the under-sea banks and wrench the rockling out of his hole among the weeds; how to skirt the wrecks lying a hundred fathoms below water and dart like a rifle bullet in at one porthole and out at another as the fishes ran; how to dance on the top of the waves when the lightning was racing all over the sky, and wave his flipper politely to the stumpy-tailed Albatross and the Man-of-war Hawk as they went down the wind; how to jump three or four feet clear of the water like a dolphin, flippers close to the side and tail curved; to leave the flying fish alone because they are all bony; to take the shoulder-piece out of a cod at full speed ten fathoms deep, and never to stop and look at a boat or a ship, but particularly a row-boat.","[6, 6, 3, 2, 6, 3, 3, 3, 3, 7, 5, 3, 9, 5, 3, 6, 3, 8, 3, 2, 3, 4, 5, 3, 5, 3, 2, 5, 3, 6, 5, 1, 7, 7, 5, 5, 3, 4, 4, 1, 5, 6, 2, 2, 3, 8, 3, 3, 2, 7, 2, 3, 6, 3, 3, 2, 5, 2, 3, 3, 2, 3, 5, 4, 3, 9, 3, 6, 3, 4, 3, 3, 3, 4, 3, 7, 8, 2, 3, 13, 9, 3, 3, 10, 4, 2, 4, 4, 4, 3, 4, 3, 2, 4, 5, 2, 4, 4, 5, 2, 3, 5, 4, 1, 7, 8, 5, 2, 3, 4, 3, 4, 6, 2, 5, 3, 6, 4, 5, 7, 4, 3, 3, 4, 2, 4, 3, 14, 3, 2, 1, 3, 2, 4, 5, 3, 7, 4, 3, 5, 2, 4, 3, 4, 2, 1, 4, 2, 1, 4, 3, 12, 1, 8]",632,"[2, 1, 1, 1, 2, 1, 1, 1, 1, 3, 2, 1, 4, 1, 1, 1, 1, 2, 1, 1, 1, 1, 2, 1, 1, 1, 1, 1, 1, 1, 1, 1, 1, 2, 2, 2, 1, 1, 1, 1, 1, 2, 1, 1, 1, 2, 1, 1, 1, 3, 1, 1, 1, 1, 1, 1, 1, 1, 1, 1, 1, 1, 1, 1, 1, 2, 1, 2, 1, 2, 1, 1, 1, 1, 1, 2, 4, 1, 1, 3, 3, 1, 1, 3, 1, 1, 1, 1, 1, 1, 1, 1, 1, 1, 1, 1, 1, 1, 2, 1, 1, 2, 1, 1, 2, 2, 1, 1, 1, 1, 1, 1, 1, 1, 2, 1, 1, 1, 2, 2, 1, 1, 1, 2, 1, 1, 1, 4, 1, 1, 1, 1, 1, 1, 0, 1, 2, 1, 1, 2, 1, 1, 1, 1, 1, 1, 1, 1, 1, 1, 1, 5, 1, 2]",201,0.137301587302,3,1,1,4
At the end of six months what Kotick did not know about deep-sea fishing was not worth the knowing.,"[2, 3, 3, 2, 3, 6, 4, 6, 3, 3, 4, 5, 8, 7, 3, 3, 5, 3, 7]",80,"[1, 1, 1, 1, 1, 1, 1, 2, 1, 1, 1, 2, 3, 2, 1, 1, 1, 1, 2]",25,-0.15,11,2,2,2
And all that time he never set flipper on dry ground.,"[3, 3, 4, 4, 2, 5, 3, 7, 2, 3, 6]",42,"[1, 1, 1, 1, 1, 2, 1, 2, 1, 1, 1]",13,-0.0666666666667,1,2,2,3
"One day, however, as he was lying half asleep in the warm water somewhere off the Island of Juan Fernandez, he felt faint and lazy all over, just as human people do when the spring is in their legs, and he remembered the good firm beaches of Novastoshnah seven thousand miles away, the games his companions played, the smell of the seaweed, the seal roar, and the fighting.","[3, 3, 7, 2, 2, 3, 5, 4, 6, 2, 3, 4, 5, 9, 3, 3, 6, 2, 4, 9, 2, 4, 5, 3, 4, 3, 4, 4, 2, 5, 6, 2, 4, 3, 6, 2, 2, 5, 4, 3, 2, 10, 3, 4, 4, 7, 2, 12, 5, 8, 5, 4, 3, 5, 3, 10, 6, 3, 5, 2, 3, 7, 3, 4, 4, 3, 3, 8]",296,"[1, 1, 3, 1, 1, 1, 1, 1, 2, 1, 1, 1, 2, 3, 1, 1, 2, 1, 1, 3, 1, 1, 1, 1, 2, 1, 2, 1, 1, 2, 1, 1, 1, 1, 1, 1, 1, 1, 1, 1, 1, 3, 1, 1, 1, 2, 1, 4, 2, 2, 1, 2, 1, 1, 1, 3, 0, 1, 1, 1, 1, 2, 1, 2, 1, 1, 1, 2]",93,0.0261904761905,5,1,1,4
"That very minute he turned north, swimming steadily, and as he went on he met scores of his mates, all bound for the same place, and they said: ""Greeting, Kotick!","[4, 4, 6, 2, 6, 5, 8, 8, 3, 2, 2, 4, 2, 2, 3, 6, 2, 3, 5, 3, 5, 3, 3, 4, 5, 3, 4, 4, 8, 6]",125,"[1, 2, 2, 1, 1, 1, 2, 4, 1, 1, 1, 1, 1, 1, 1, 1, 1, 1, 1, 1, 1, 1, 1, 1, 1, 1, 1, 1, 2, 2]",38,0.122222222222,0,1,1,2
"This year we are all holluschickie, and we can dance the Fire-dance in the breakers off Lukannon and play on the new grass.","[4, 4, 2, 3, 3, 13, 3, 2, 3, 5, 3, 10, 2, 3, 8, 3, 8, 3, 4, 2, 3, 3, 5]",99,"[1, 2, 1, 1, 1, 4, 1, 1, 1, 1, 1, 3, 1, 1, 3, 1, 3, 1, 1, 1, 1, 1, 1]",33,0.136363636364,14,1,1,2
"But where did you get that coat?""","[3, 5, 3, 3, 3, 4, 4]",25,"[1, 1, 1, 1, 1, 1, 1]",7,0.0,6,2,2,3
"Kotick's fur was almost pure white now, and though he felt very proud of it, he only said, ""Swim quickly!","[6, 2, 3, 3, 6, 4, 5, 3, 3, 6, 2, 4, 4, 5, 2, 2, 2, 4, 4, 4, 7]",81,"[2, 0, 1, 1, 2, 1, 1, 1, 1, 1, 1, 1, 2, 1, 1, 1, 1, 2, 1, 1, 2]",25,0.32619047619,8,0,0,0
"My bones are aching for the land.""","[2, 5, 3, 6, 3, 3, 4]",26,"[1, 1, 1, 2, 1, 1, 1]",8,0.0,6,2,2,3
"And so they all came to the beaches where they had been born, and heard the old seals, their fathers, fighting in the rolling mist.","[3, 2, 4, 3, 4, 2, 3, 7, 5, 4, 3, 4, 4, 3, 5, 3, 3, 5, 5, 7, 8, 2, 3, 7, 4]",103,"[1, 1, 1, 1, 1, 1, 1, 2, 1, 1, 1, 1, 1, 1, 2, 1, 1, 2, 1, 2, 2, 1, 1, 2, 1]",31,0.1,14,1,1,2
That night Kotick danced the Fire-dance with the yearling seals.,"[4, 5, 6, 6, 3, 10, 4, 3, 8, 5]",54,"[1, 1, 2, 1, 1, 3, 1, 1, 3, 2]",16,0.0,1,2,2,3
"The sea is full of fire on summer nights all the way down from Novastoshnah to Lukannon, and each seal leaves a wake like burning oil behind him and a flaming flash when he jumps, and the waves break in great phosphorescent streaks and swirls.","[3, 3, 2, 4, 2, 4, 2, 6, 6, 3, 3, 3, 4, 4, 12, 2, 8, 3, 4, 4, 6, 1, 4, 4, 7, 3, 6, 3, 3, 1, 7, 5, 4, 2, 5, 3, 3, 5, 5, 2, 5, 14, 7, 3, 6]",196,"[1, 2, 1, 1, 1, 1, 1, 2, 1, 1, 1, 1, 1, 1, 4, 1, 3, 1, 2, 2, 2, 1, 1, 1, 2, 1, 2, 1, 1, 1, 2, 1, 1, 1, 1, 1, 1, 1, 2, 1, 2, 4, 2, 1, 1]",64,0.148611111111,15,1,1,4
Then they went inland to the holluschickie grounds and rolled up and down in the new wild wheat and told stories of what they had done while they had been at sea.,"[4, 4, 4, 6, 2, 3, 13, 7, 3, 6, 2, 3, 4, 2, 3, 3, 4, 5, 3, 4, 7, 2, 4, 4, 3, 4, 5, 4, 3, 4, 2, 3]",130,"[1, 1, 1, 2, 1, 1, 4, 1, 1, 1, 1, 1, 1, 1, 1, 1, 1, 2, 1, 1, 2, 1, 1, 1, 1, 1, 1, 1, 1, 1, 1, 2]",39,0.026936026936,0,1,1,2
"They talked about the Pacific as boys would talk about a wood that they had been nutting in, and if anyone had understood them he could have gone away and made such a chart of that ocean as never was.","[4, 6, 5, 3, 7, 2, 4, 5, 4, 5, 1, 4, 4, 4, 3, 4, 7, 2, 3, 2, 6, 3, 10, 4, 2, 5, 4, 4, 4, 3, 4, 4, 1, 5, 2, 4, 5, 2, 5, 3]",159,"[1, 1, 2, 1, 3, 1, 1, 1, 1, 2, 1, 1, 1, 1, 1, 1, 2, 1, 1, 1, 2, 1, 3, 1, 1, 1, 1, 1, 2, 1, 1, 1, 1, 1, 1, 1, 3, 1, 2, 1]",52,0.0,0,1,1,2
"The three- and four-year-old holluschickie romped down from Hutchinson's Hill crying: ""Out of the way, youngsters!","[3, 5, 3, 13, 13, 6, 4, 4, 10, 2, 4, 6, 3, 2, 3, 3, 10]",94,"[1, 1, 1, 4, 4, 1, 1, 1, 3, 0, 1, 1, 1, 1, 1, 1, 2]",25,-0.202777777778,11,2,2,2
The sea is deep and you don't know all that's in it yet.,"[3, 3, 2, 4, 3, 3, 2, 3, 4, 3, 4, 2, 2, 2, 3]",43,"[1, 2, 1, 1, 1, 1, 1, 0, 1, 1, 1, 0, 1, 1, 1]",14,0.0,1,2,2,3
Wait till you've rounded the Horn.,"[4, 4, 3, 3, 7, 3, 4]",28,"[1, 1, 1, 0, 1, 1, 1]",6,0.0,6,2,2,3
"Hi, you yearling, where did you get that white coat?""","[2, 3, 8, 5, 3, 3, 3, 4, 5, 4]",40,"[1, 1, 3, 1, 1, 1, 1, 1, 1, 1]",12,0.0,1,2,2,3
"""I didn't get it,"" said Kotick.","[1, 3, 3, 3, 2, 4, 6]",22,"[1, 1, 0, 1, 1, 1, 2]",7,0.0,6,2,2,3
"""It grew.""","[2, 4]",6,"[1, 1]",2,0.0,6,2,2,3
"And just as he was going to roll the speaker over, a couple of black-haired men with flat red faces came from behind a sand dune, and Kotick, who had never seen a man before, coughed and lowered his head.","[3, 4, 2, 2, 3, 5, 2, 4, 3, 7, 4, 1, 6, 2, 12, 3, 4, 4, 3, 5, 4, 4, 6, 1, 4, 4, 3, 6, 3, 3, 5, 4, 1, 3, 6, 7, 3, 7, 3, 4]",160,"[1, 1, 1, 1, 1, 1, 1, 1, 1, 3, 2, 1, 1, 1, 2, 1, 1, 1, 0, 1, 1, 1, 2, 1, 1, 1, 1, 2, 1, 1, 2, 1, 1, 1, 2, 1, 1, 2, 1, 2]",49,-0.141666666667,13,1,1,2
The holluschickie just bundled off a few yards and sat staring stupidly.,"[3, 13, 4, 7, 3, 1, 3, 5, 3, 3, 7, 8]",60,"[1, 4, 1, 1, 1, 1, 1, 2, 1, 1, 2, 3]",19,-0.5,4,2,2,1
"The men were no less than Kerick Booterin, the chief of the seal-hunters on the island, and Patalamon, his son.","[3, 3, 4, 2, 4, 4, 6, 8, 3, 5, 2, 3, 12, 2, 3, 6, 3, 9, 3, 3]",88,"[1, 1, 1, 1, 1, 1, 2, 3, 1, 2, 1, 1, 4, 1, 1, 2, 1, 4, 1, 1]",31,0.0833333333333,14,2,2,2
"They came from the little village not half a mile from the sea nurseries, and they were deciding what seals they would drive up to the killing pens--for the seals were driven just like sheep--to be turned into seal-skin jackets later on.","[4, 4, 4, 3, 6, 7, 3, 4, 1, 4, 4, 3, 3, 9, 3, 4, 4, 8, 4, 5, 4, 5, 5, 2, 2, 3, 7, 4, 3, 3, 5, 4, 6, 4, 4, 5, 2, 2, 6, 4, 9, 7, 5, 2]",190,"[1, 1, 1, 1, 1, 2, 1, 1, 1, 1, 1, 1, 2, 3, 1, 1, 1, 3, 1, 2, 1, 1, 1, 1, 1, 1, 2, 1, 1, 1, 2, 1, 2, 1, 1, 1, 1, 1, 1, 2, 3, 2, 2, 1]",59,-0.0347222222222,18,1,1,4
"""Ho!""",[2],2,[1],1,0.0,6,2,2,3
said Patalamon.,"[4, 9]",13,"[1, 4]",5,0.0,6,2,2,3
"""Look!",[4],4,[1],1,0.0,6,2,2,3
"There's a white seal!""","[5, 2, 1, 5, 4]",17,"[1, 0, 1, 1, 2]",5,0.0,6,2,2,3
"Kerick Booterin turned nearly white under his oil and smoke, for he was an Aleut, and Aleuts are not clean people.","[6, 8, 6, 6, 5, 5, 3, 3, 3, 5, 3, 2, 3, 2, 5, 3, 6, 3, 3, 5, 6]",91,"[2, 3, 1, 3, 1, 2, 1, 1, 1, 1, 1, 1, 1, 1, 2, 1, 2, 1, 1, 2, 1]",30,-0.0916666666667,14,2,2,2
Then he began to mutter a prayer.,"[4, 2, 5, 2, 6, 1, 6]",26,"[1, 1, 2, 1, 2, 1, 1]",9,0.0,1,2,2,3
"""Don't touch him, Patalamon.","[2, 3, 5, 3, 9]",22,"[1, 0, 1, 1, 4]",7,0.0,6,2,2,3
There has never been a white seal since--since I was born.,"[5, 3, 5, 4, 1, 5, 4, 5, 5, 1, 3, 4]",45,"[1, 1, 2, 1, 1, 1, 2, 1, 1, 1, 1, 1]",14,0.0,1,2,2,3
Perhaps it is old Zaharrof's ghost.,"[7, 2, 2, 3, 8, 2, 5]",29,"[2, 1, 1, 1, 3, 0, 1]",9,0.1,1,2,2,3
"He was lost last year in the big gale.""","[2, 3, 4, 4, 4, 2, 3, 3, 4]",29,"[1, 1, 1, 1, 2, 1, 1, 1, 1]",10,0.0,1,2,2,3
"""I'm not going near him,"" said Patalamon.","[1, 2, 3, 5, 4, 3, 4, 9]",31,"[1, 0, 1, 1, 2, 1, 1, 4]",11,0.1,1,2,2,3
"""He's unlucky.","[2, 2, 7]",11,"[1, 0, 3]",4,0.0,6,2,2,3
Do you really think he is old Zaharrof come back?,"[2, 3, 6, 5, 2, 2, 3, 8, 4, 4]",39,"[1, 1, 3, 1, 1, 1, 1, 3, 1, 1]",14,0.1,1,2,2,3
"I owe him for some gulls' eggs.""","[1, 3, 3, 3, 4, 5, 4]",23,"[1, 1, 1, 1, 1, 1, 1]",7,0.0,6,2,2,3
"""Don't look at him,"" said Kerick.","[2, 3, 4, 2, 3, 4, 6]",24,"[1, 0, 1, 1, 1, 1, 2]",7,0.0,6,2,2,3
"""Head off that drove of four-year-olds.","[4, 3, 4, 5, 2, 14]",32,"[2, 1, 1, 1, 1, 4]",10,0.0,1,2,2,3
"The men ought to skin two hundred to-day, but it's the beginning of the season and they are new to the work.","[3, 3, 5, 2, 4, 3, 7, 6, 3, 2, 2, 3, 9, 2, 3, 6, 3, 4, 3, 3, 2, 3, 4]",85,"[1, 1, 1, 1, 1, 1, 1, 2, 1, 1, 0, 1, 3, 1, 1, 3, 1, 1, 1, 1, 1, 1, 1]",27,0.136363636364,8,2,2,2
A hundred will do.,"[1, 7, 4, 2]",14,"[1, 1, 1, 1]",4,0.0,6,2,2,3
"Quick!""",[5],5,[1],1,0.416666666667,7,0,0,0
"Patalamon rattled a pair of seal's shoulder bones in front of a herd of holluschickie and they stopped dead, puffing and blowing.","[9, 7, 1, 4, 2, 4, 2, 8, 5, 2, 5, 2, 1, 4, 2, 13, 3, 4, 7, 4, 7, 3, 7]",106,"[4, 1, 1, 1, 1, 2, 0, 2, 1, 1, 1, 1, 1, 1, 1, 4, 1, 1, 1, 2, 2, 1, 2]",33,-0.2,11,1,1,2
"Then he stepped near and the seals began to move, and Kerick headed them inland, and they never tried to get back to their companions.","[4, 2, 7, 4, 3, 3, 5, 5, 2, 4, 3, 6, 6, 4, 6, 3, 4, 5, 5, 2, 3, 4, 2, 5, 10]",107,"[1, 1, 1, 2, 1, 1, 2, 2, 1, 1, 1, 2, 2, 1, 2, 1, 1, 2, 1, 1, 1, 1, 1, 1, 3]",34,0.05,14,1,1,2
"Hundreds and hundreds of thousands of seals watched them being driven, but they went on playing just the same.","[8, 3, 8, 2, 9, 2, 5, 7, 4, 5, 6, 3, 4, 4, 2, 7, 4, 3, 4]",90,"[2, 1, 2, 1, 2, 1, 2, 1, 1, 1, 2, 1, 1, 1, 1, 1, 1, 1, 1]",24,0.0,16,2,2,2
"Kotick was the only one who asked questions, and none of his companions could tell him anything, except that the men always drove seals in that way for six weeks or two months of every year.","[6, 3, 3, 4, 3, 3, 5, 9, 3, 4, 2, 3, 10, 5, 4, 3, 8, 6, 4, 3, 3, 6, 5, 5, 2, 4, 3, 3, 3, 5, 2, 3, 6, 2, 5, 4]",152,"[2, 1, 1, 2, 1, 1, 1, 2, 1, 1, 1, 1, 3, 1, 1, 1, 3, 2, 1, 1, 1, 2, 1, 2, 1, 1, 1, 1, 1, 1, 1, 1, 1, 1, 3, 2]",49,0.0,0,1,1,2
"""I am going to follow,"" he said, and his eyes nearly popped out of his head as he shuffled along in the wake of the herd.","[1, 2, 5, 2, 6, 2, 4, 3, 3, 4, 6, 6, 3, 2, 3, 4, 2, 2, 8, 5, 2, 3, 4, 2, 3, 4]",91,"[1, 1, 1, 1, 2, 1, 1, 1, 1, 0, 3, 1, 1, 1, 1, 2, 1, 1, 1, 2, 1, 1, 1, 1, 1, 1]",30,0.1,14,2,2,2
"""The white seal is coming after us,"" cried Patalamon.","[3, 5, 4, 2, 6, 5, 2, 5, 9]",41,"[1, 1, 2, 1, 2, 2, 1, 1, 4]",15,0.0,1,2,2,3
"""That's the first time a seal has ever come to the killing-grounds alone.""","[4, 2, 3, 5, 4, 1, 4, 3, 4, 4, 2, 3, 15, 5]",59,"[1, 0, 1, 1, 1, 1, 2, 1, 2, 1, 1, 1, 3, 2]",18,0.25,17,0,0,0
"""Hsh!",[3],3,[0],0,0.0,6,2,2,3
"Don't look behind you,"" said Kerick.","[2, 3, 4, 6, 3, 4, 6]",28,"[1, 0, 1, 2, 1, 1, 2]",8,-0.4,4,2,2,1
"""It is Zaharrof's ghost!","[2, 2, 8, 2, 5]",19,"[1, 1, 3, 0, 1]",6,0.0,6,2,2,3
"I must speak to the priest about this.""","[1, 4, 5, 2, 3, 6, 5, 4]",30,"[1, 1, 2, 1, 1, 2, 2, 1]",11,0.0,1,2,2,3
"The distance to the killing-grounds was only half a mile, but it took an hour to cover, because if the seals went too fast Kerick knew that they would get heated and then their fur would come off in patches when they were skinned.","[3, 8, 2, 3, 15, 3, 4, 4, 1, 4, 3, 2, 4, 2, 4, 2, 5, 7, 2, 3, 5, 4, 3, 4, 6, 4, 4, 4, 5, 3, 6, 3, 4, 5, 3, 5, 4, 3, 2, 7, 4, 4, 4, 7]",184,"[1, 2, 1, 1, 3, 1, 2, 1, 1, 1, 1, 1, 1, 1, 1, 1, 2, 2, 1, 1, 2, 1, 1, 1, 2, 1, 1, 1, 1, 1, 2, 1, 1, 1, 1, 1, 1, 1, 1, 1, 1, 1, 1, 1]",53,0.0111111111111,0,1,1,4
"So they went on very slowly, past Sea Lion's Neck, past Webster House, till they came to the Salt House just beyond the sight of the seals on the beach.","[2, 4, 4, 2, 4, 6, 4, 3, 4, 2, 4, 4, 7, 5, 4, 4, 4, 2, 3, 4, 5, 4, 6, 3, 5, 2, 3, 5, 2, 3, 5]",119,"[1, 1, 1, 1, 2, 2, 1, 2, 1, 0, 1, 1, 2, 1, 1, 1, 1, 1, 1, 1, 1, 1, 1, 1, 1, 1, 1, 2, 1, 1, 2]",36,-0.25,11,1,1,2
"Kotick followed, panting and wondering.","[6, 8, 7, 3, 9]",33,"[2, 2, 2, 1, 3]",10,0.0,1,2,2,3
"He thought that he was at the world's end, but the roar of the seal nurseries behind him sounded as loud as the roar of a train in a tunnel.","[2, 7, 4, 2, 3, 2, 3, 5, 2, 3, 3, 3, 4, 2, 3, 4, 9, 6, 3, 7, 2, 4, 2, 3, 4, 2, 1, 5, 2, 1, 6]",109,"[1, 1, 1, 1, 1, 1, 1, 1, 0, 1, 1, 1, 1, 1, 1, 2, 3, 2, 1, 1, 1, 1, 1, 1, 1, 1, 1, 1, 1, 1, 2]",35,-0.15,11,1,1,2
"Then Kerick sat down on the moss and pulled out a heavy pewter watch and let the drove cool off for thirty minutes, and Kotick could hear the fog-dew dripping off the brim of his cap.","[4, 6, 3, 4, 2, 3, 4, 3, 6, 3, 1, 5, 6, 5, 3, 3, 3, 5, 4, 3, 3, 6, 7, 3, 6, 5, 4, 3, 7, 8, 3, 3, 4, 2, 3, 3]",146,"[1, 2, 1, 1, 1, 1, 1, 1, 1, 1, 1, 3, 2, 1, 1, 1, 1, 1, 1, 1, 1, 2, 2, 1, 2, 1, 2, 1, 2, 2, 1, 1, 1, 1, 1, 1]",46,-0.00185185185185,0,1,1,2
"Then ten or twelve men, each with an iron-bound club three or four feet long, came up, and Kerick pointed out one or two of the drove that were bitten by their companions or too hot, and the men kicked those aside with their heavy boots made of the skin of a walrus's throat, and then Kerick said, ""Let go!""","[4, 3, 2, 6, 3, 4, 4, 2, 10, 4, 5, 2, 4, 4, 4, 4, 2, 3, 6, 7, 3, 3, 2, 3, 2, 3, 5, 4, 4, 6, 2, 5, 10, 2, 3, 3, 3, 3, 3, 6, 5, 5, 4, 5, 5, 5, 4, 2, 3, 4, 2, 1, 6, 2, 6, 3, 4, 6, 4, 3, 2]",239,"[1, 1, 1, 1, 1, 2, 1, 1, 3, 1, 1, 1, 1, 1, 1, 1, 1, 1, 2, 1, 1, 1, 1, 1, 1, 1, 1, 1, 1, 2, 1, 1, 3, 1, 1, 1, 1, 1, 1, 1, 1, 2, 1, 1, 3, 1, 1, 1, 1, 1, 1, 1, 2, 0, 1, 1, 1, 2, 1, 1, 1]",72,-0.0125,18,1,1,4
and then the men clubbed the seals on the head as fast as they could.,"[3, 4, 3, 3, 7, 3, 5, 2, 3, 4, 2, 4, 2, 4, 5]",54,"[1, 1, 1, 1, 1, 1, 2, 1, 1, 2, 1, 1, 1, 1, 1]",17,0.2,17,2,2,3
"Ten minutes later little Kotick did not recognize his friends any more, for their skins were ripped off from the nose to the hind flippers, whipped off and thrown down on the ground in a pile.","[3, 7, 5, 6, 6, 3, 3, 9, 3, 7, 3, 4, 3, 5, 5, 4, 6, 3, 4, 3, 4, 2, 3, 4, 8, 7, 3, 3, 6, 4, 2, 3, 6, 2, 1, 4]",154,"[1, 2, 2, 1, 2, 1, 1, 3, 1, 2, 2, 1, 1, 1, 1, 1, 1, 1, 1, 1, 1, 1, 1, 1, 2, 1, 1, 1, 1, 1, 1, 1, 1, 1, 1, 1]",44,0.0313888888889,0,1,1,2
That was enough for Kotick.,"[4, 3, 6, 3, 6]",22,"[1, 1, 2, 1, 2]",7,0.0,6,2,2,3
He turned and galloped (a seal can gallop very swiftly for a short time) back to the sea; his little new mustache bristling with horror.,"[2, 6, 3, 8, 1, 4, 3, 6, 4, 7, 3, 1, 5, 4, 4, 2, 3, 3, 3, 6, 3, 8, 9, 4, 6]",108,"[1, 1, 1, 2, 1, 2, 1, 2, 2, 2, 1, 1, 1, 1, 1, 1, 1, 2, 1, 1, 1, 2, 2, 1, 2]",34,0.0297727272727,14,1,1,2
"At Sea Lion's Neck, where the great sea lions sit on the edge of the surf, he flung himself flipper-overhead into the cool water and rocked there, gasping miserably.","[2, 3, 4, 2, 4, 5, 3, 5, 3, 5, 3, 2, 3, 4, 2, 3, 4, 2, 5, 7, 16, 4, 3, 4, 5, 3, 6, 5, 7, 9]",133,"[1, 2, 1, 0, 1, 1, 1, 2, 2, 1, 1, 1, 1, 1, 1, 1, 1, 1, 1, 2, 6, 2, 1, 1, 2, 1, 1, 1, 2, 4]",44,0.05,0,1,1,2
"""What's here?""","[4, 2, 4]",10,"[1, 0, 1]",2,0.0,6,2,2,3
"said a sea lion gruffly, for as a rule the sea lions keep themselves to themselves.","[4, 1, 3, 4, 7, 3, 2, 1, 4, 3, 3, 5, 4, 10, 2, 10]",66,"[1, 1, 2, 1, 2, 1, 1, 1, 1, 1, 2, 1, 1, 2, 1, 2]",21,0.0,16,2,2,3
"""Scoochnie!",[9],9,[2],2,0.0,6,2,2,3
"Ochen scoochnie!""","[5, 9]",14,"[2, 2]",4,0.0,6,2,2,3
"(""I'm lonesome, very lonesome!"")","[1, 2, 8, 4, 8]",23,"[1, 0, 3, 2, 3]",9,0.25,17,0,0,3
said Kotick.,"[4, 6]",10,"[1, 2]",3,0.0,6,2,2,3
"""They're killing all the holluschickie on all the beaches!""","[4, 3, 7, 3, 3, 13, 2, 3, 3, 7]",48,"[1, 0, 2, 1, 1, 4, 1, 1, 1, 2]",14,0.0,1,2,2,3
The Sea Lion turned his head inshore.,"[3, 3, 4, 6, 3, 4, 7]",30,"[1, 2, 1, 1, 1, 2, 2]",10,0.0,1,2,2,3
"""Nonsense!""",[8],8,[2],2,0.0,6,2,2,3
he said.,"[2, 4]",6,"[1, 1]",2,0.0,6,2,2,3
"""Your friends are making as much noise as ever.","[4, 7, 3, 6, 2, 4, 5, 2, 4]",37,"[1, 2, 1, 2, 1, 1, 1, 1, 2]",12,0.2,17,2,2,3
You must have seen old Kerick polishing off a drove.,"[3, 4, 4, 4, 3, 6, 9, 3, 1, 5]",42,"[1, 1, 1, 1, 1, 2, 3, 1, 1, 1]",13,0.1,1,2,2,3
"He's done that for thirty years.""","[2, 2, 4, 4, 3, 6, 5]",26,"[1, 0, 1, 1, 1, 2, 2]",8,0.0,6,2,2,3
"""It's horrible,"" said Kotick, backing water as a wave went over him, and steadying himself with a screw stroke of his flippers that brought him all standing within three inches of a jagged edge of rock.","[2, 2, 8, 4, 6, 7, 5, 2, 1, 4, 4, 4, 3, 3, 9, 7, 4, 1, 5, 6, 2, 3, 8, 4, 7, 3, 3, 8, 6, 5, 6, 2, 1, 6, 4, 2, 4]",161,"[1, 0, 2, 1, 2, 2, 2, 1, 1, 1, 1, 2, 1, 1, 3, 2, 1, 1, 1, 1, 1, 1, 2, 1, 1, 1, 1, 2, 2, 1, 1, 1, 1, 1, 1, 1, 1]",47,-1.0,12,1,1,1
"""Well done for a yearling!""","[4, 4, 3, 1, 8]",20,"[1, 1, 1, 1, 3]",7,0.0,6,2,2,3
"said the Sea Lion, who could appreciate good swimming.","[4, 3, 3, 4, 3, 5, 10, 4, 8]",44,"[1, 1, 2, 1, 1, 1, 4, 1, 2]",14,0.7,2,0,0,0
"""I suppose it is rather awful from your way of looking at it, but if you seals will come here year after year, of course the men get to know of it, and unless you can find an island where no men ever come you will always be driven.""","[1, 7, 2, 2, 6, 5, 4, 4, 3, 2, 7, 2, 2, 3, 2, 3, 5, 4, 4, 4, 4, 5, 4, 2, 6, 3, 3, 3, 2, 4, 2, 2, 3, 6, 3, 3, 4, 2, 6, 5, 2, 3, 4, 4, 3, 4, 6, 2, 6]",178,"[1, 2, 1, 1, 2, 2, 1, 1, 1, 1, 2, 1, 1, 1, 1, 1, 2, 1, 1, 1, 2, 2, 2, 1, 1, 1, 1, 1, 1, 1, 1, 1, 1, 2, 1, 1, 1, 1, 2, 1, 1, 1, 2, 1, 1, 1, 2, 1, 2]",62,-1.0,12,1,1,1
