"Kala Nag will obey none but me, so I must go with him into the Keddah, but he is only a fighting elephant, and he does not help to rope them.","[4, 3, 4, 4, 4, 3, 2, 2, 1, 4, 2, 4, 3, 4, 3, 6, 3, 2, 2, 4, 1, 8, 8, 3, 2, 4, 3, 4, 2, 4, 4]",107,"[2, 1, 1, 2, 1, 1, 1, 1, 1, 1, 1, 1, 1, 2, 1, 2, 1, 1, 1, 2, 1, 2, 3, 1, 1, 0, 1, 1, 1, 1, 1]",38,0.0,14,1,1,2
"So I sit at my ease, as befits a mahout,--not a mere hunter,--a mahout, I say, and a man who gets a pension at the end of his service.","[2, 1, 3, 2, 2, 4, 2, 6, 1, 6, 3, 1, 4, 6, 1, 6, 1, 3, 3, 1, 3, 3, 4, 1, 7, 2, 3, 3, 2, 3, 7]",96,"[1, 1, 1, 1, 1, 2, 1, 2, 1, 2, 1, 1, 1, 2, 1, 2, 1, 1, 1, 1, 1, 1, 1, 1, 2, 1, 1, 1, 1, 1, 2]",38,-0.5,11,1,1,1
Is the family of Toomai of the Elephants to be trodden underfoot in the dirt of a Keddah?,"[2, 3, 6, 2, 6, 2, 3, 9, 2, 2, 7, 9, 2, 3, 4, 2, 1, 6]",71,"[1, 1, 3, 1, 2, 1, 1, 3, 1, 1, 2, 3, 1, 1, 1, 1, 1, 2]",27,0.0,16,2,2,2
Bad one!,"[3, 3]",6,"[1, 1]",2,-0.875,19,2,2,1
Wicked one!,"[6, 3]",9,"[1, 1]",2,0.0,6,2,2,3
Worthless son!,"[9, 3]",12,"[2, 1]",3,-1.0,19,2,2,1
"Go and wash Kala Nag and attend to his ears, and see that there are no thorns in his feet.","[2, 3, 4, 4, 3, 3, 6, 2, 3, 4, 3, 3, 4, 5, 3, 2, 6, 2, 3, 4]",69,"[1, 1, 1, 2, 1, 1, 2, 1, 1, 2, 1, 1, 1, 1, 1, 1, 1, 1, 1, 1]",23,0.0,16,2,2,2
"Or else Petersen Sahib will surely catch thee and make thee a wild hunter--a follower of elephant's foot tracks, a jungle bear.","[2, 4, 8, 5, 4, 6, 5, 4, 3, 4, 4, 1, 4, 6, 1, 8, 2, 8, 2, 4, 6, 1, 6, 4]",102,"[1, 1, 3, 2, 1, 3, 1, 1, 1, 1, 1, 1, 1, 2, 1, 3, 1, 3, 0, 1, 1, 1, 1, 2]",34,0.3,8,0,0,2
Bah!,[3],3,[1],1,0.0,6,2,2,3
Shame!,[5],5,[1],1,0.0,6,2,2,3
"Go!""",[2],2,[1],1,0.0,6,2,2,3
"Little Toomai went off without saying a word, but he told Kala Nag all his grievances while he was examining his feet.","[6, 6, 4, 3, 7, 6, 1, 4, 3, 2, 4, 4, 3, 3, 3, 10, 5, 2, 3, 9, 3, 4]",95,"[1, 2, 1, 1, 2, 1, 1, 1, 1, 1, 1, 2, 1, 1, 1, 3, 1, 1, 1, 4, 1, 1]",30,-0.1875,11,2,2,2
"""No matter,"" said Little Toomai, turning up the fringe of Kala Nag's huge right ear.","[2, 6, 4, 6, 6, 7, 2, 3, 6, 2, 4, 3, 2, 4, 5, 3]",65,"[1, 2, 1, 1, 2, 2, 1, 1, 1, 1, 2, 1, 0, 1, 1, 2]",20,0.166071428571,17,2,2,3
"""They have said my name to Petersen Sahib, and perhaps--and perhaps--and perhaps--who knows?","[4, 4, 4, 2, 4, 2, 8, 5, 3, 7, 3, 7, 3, 7, 3, 5]",71,"[1, 1, 1, 1, 1, 1, 3, 2, 1, 2, 1, 2, 1, 2, 1, 1]",22,0.0,16,2,2,2
Hai!,[3],3,[1],1,0.0,6,2,2,3
"That is a big thorn that I have pulled out!""","[4, 2, 1, 3, 5, 4, 1, 4, 6, 3]",33,"[1, 1, 1, 1, 1, 1, 1, 1, 1, 1]",10,0.0,1,2,2,3
"The next few days were spent in getting the elephants together, in walking the newly caught wild elephants up and down between a couple of tame ones to prevent them giving too much trouble on the downward march to the plains, and in taking stock of the blankets and ropes and things that had been worn out or lost in the forest.","[3, 4, 3, 4, 4, 5, 2, 7, 3, 9, 8, 2, 7, 3, 5, 6, 4, 9, 2, 3, 4, 7, 1, 6, 2, 4, 4, 2, 7, 4, 6, 3, 4, 7, 2, 3, 8, 5, 2, 3, 6, 3, 2, 6, 5, 2, 3, 8, 3, 5, 3, 6, 4, 3, 4, 4, 3, 2, 4, 2, 3, 6]",264,"[1, 1, 1, 1, 1, 1, 1, 2, 1, 3, 3, 1, 2, 1, 2, 1, 1, 3, 1, 1, 1, 2, 1, 1, 1, 1, 1, 1, 2, 1, 2, 1, 1, 1, 1, 1, 2, 1, 1, 1, 1, 1, 1, 2, 1, 1, 1, 2, 1, 1, 1, 1, 1, 1, 1, 1, 1, 1, 1, 1, 1, 2]",78,-0.0794823232323,18,1,1,4
"Petersen Sahib came in on his clever she-elephant Pudmini; he had been paying off other camps among the hills, for the season was coming to an end, and there was a native clerk sitting at a table under a tree, to pay the drivers their wages.","[8, 5, 4, 2, 2, 3, 6, 12, 7, 2, 3, 4, 6, 3, 5, 5, 5, 3, 5, 3, 3, 6, 3, 6, 2, 2, 3, 3, 5, 3, 1, 6, 5, 7, 2, 1, 5, 5, 1, 4, 2, 3, 3, 7, 5, 5]",191,"[3, 2, 1, 1, 1, 1, 2, 4, 3, 1, 1, 1, 1, 1, 2, 1, 2, 1, 1, 1, 1, 3, 1, 2, 1, 1, 1, 1, 1, 1, 1, 2, 1, 2, 1, 1, 1, 2, 1, 1, 1, 1, 1, 2, 1, 1]",64,0.0208333333333,18,1,1,4
"As each man was paid he went back to his elephant, and joined the line that stood ready to start.","[2, 4, 3, 3, 4, 2, 4, 4, 2, 3, 8, 3, 6, 3, 4, 4, 5, 5, 2, 5]",76,"[1, 2, 1, 1, 1, 1, 1, 1, 1, 1, 3, 1, 1, 1, 1, 1, 1, 3, 1, 1]",25,0.1,16,2,2,2
"The catchers, and hunters, and beaters, the men of the regular Keddah, who stayed in the jungle year in and year out, sat on the backs of the elephants that belonged to Petersen Sahib's permanent force, or leaned against the trees with their guns across their arms, and made fun of the drivers who were going away, and laughed when the newly caught elephants broke the line and ran about.","[3, 8, 3, 7, 3, 7, 3, 3, 2, 3, 7, 6, 3, 6, 2, 3, 6, 4, 2, 3, 4, 3, 3, 2, 3, 5, 2, 3, 9, 4, 8, 2, 8, 5, 2, 9, 5, 2, 6, 7, 3, 5, 4, 5, 4, 6, 5, 4, 3, 4, 3, 2, 3, 7, 3, 4, 5, 4, 3, 7, 4, 3, 5, 6, 9, 5, 3, 4, 3, 3, 5]",310,"[1, 2, 1, 2, 1, 3, 1, 1, 1, 1, 3, 2, 1, 0, 1, 1, 1, 2, 1, 1, 2, 1, 1, 1, 1, 1, 1, 1, 3, 1, 2, 1, 3, 2, 0, 3, 1, 1, 2, 2, 1, 0, 1, 1, 1, 2, 1, 1, 1, 1, 1, 1, 1, 2, 1, 1, 1, 2, 1, 1, 1, 1, 2, 1, 3, 1, 1, 1, 1, 1, 2]",94,0.284090909091,5,1,1,4
"Big Toomai went up to the clerk with Little Toomai behind him, and Machua Appa, the head tracker, said in an undertone to a friend of his, ""There goes one piece of good elephant stuff at least.","[3, 6, 4, 2, 2, 3, 5, 4, 6, 6, 6, 3, 3, 6, 4, 3, 4, 7, 4, 2, 2, 9, 2, 1, 6, 2, 3, 5, 4, 3, 5, 2, 4, 8, 5, 2, 5]",151,"[1, 2, 1, 1, 1, 1, 1, 1, 1, 2, 2, 1, 1, 2, 2, 1, 2, 2, 1, 1, 1, 3, 1, 1, 2, 1, 1, 1, 0, 1, 2, 1, 1, 3, 1, 1, 2]",50,-0.0375,0,1,1,2
"'Tis a pity to send that young jungle-cock to molt in the plains.""","[2, 2, 1, 4, 2, 4, 4, 5, 11, 2, 4, 2, 3, 6]",52,"[0, 1, 1, 2, 1, 1, 1, 1, 3, 1, 1, 1, 1, 1]",16,0.0,1,2,2,3
"Now Petersen Sahib had ears all over him, as a man must have who listens to the most silent of all living things--the wild elephant.","[3, 8, 5, 3, 4, 3, 4, 3, 2, 1, 3, 4, 4, 3, 7, 2, 3, 4, 6, 2, 3, 6, 6, 3, 4, 8]",104,"[1, 3, 2, 1, 2, 1, 2, 1, 1, 1, 1, 1, 1, 1, 2, 1, 1, 1, 2, 1, 1, 2, 1, 1, 1, 3]",36,0.2,8,1,1,2
"He turned where he was lying all along on Pudmini's back and said, ""What is that?","[2, 6, 5, 2, 3, 5, 3, 5, 2, 7, 2, 4, 3, 4, 4, 2, 4]",63,"[1, 1, 1, 1, 1, 1, 1, 2, 1, 3, 0, 1, 1, 1, 1, 1, 1]",19,0.0,16,2,2,3
"I did not know of a man among the plains-drivers who had wit enough to rope even a dead elephant.""","[1, 3, 3, 4, 2, 1, 3, 5, 3, 14, 3, 3, 3, 6, 2, 4, 4, 1, 4, 8]",77,"[1, 1, 1, 1, 1, 1, 1, 2, 1, 3, 1, 1, 1, 2, 1, 1, 2, 1, 2, 3]",28,-0.1,11,2,2,2
"""This is not a man, but a boy.","[4, 2, 3, 1, 3, 3, 1, 3]",20,"[1, 1, 1, 1, 1, 1, 1, 1]",8,0.0,6,2,2,3
"He went into the Keddah at the last drive, and threw Barmao there the rope, when we were trying to get that young calf with the blotch on his shoulder away from his mother.""","[2, 4, 4, 3, 6, 2, 3, 4, 5, 3, 5, 6, 5, 3, 4, 4, 2, 4, 6, 2, 3, 4, 5, 4, 4, 3, 6, 2, 3, 8, 4, 4, 3, 6]",136,"[1, 1, 2, 1, 2, 1, 1, 1, 1, 1, 1, 2, 1, 1, 1, 1, 1, 1, 1, 1, 1, 1, 1, 1, 1, 1, 1, 1, 1, 2, 2, 1, 1, 2]",40,0.05,0,1,1,2
"Machua Appa pointed at Little Toomai, and Petersen Sahib looked, and Little Toomai bowed to the earth.","[6, 4, 7, 2, 6, 6, 3, 8, 5, 6, 3, 6, 6, 5, 2, 3, 5]",83,"[2, 2, 1, 1, 1, 2, 1, 3, 2, 1, 1, 1, 2, 1, 1, 1, 2]",25,-0.1875,11,2,2,2
"""He throw a rope?","[2, 5, 1, 4]",12,"[1, 1, 1, 1]",4,0.0,6,2,2,3
He is smaller than a picket-pin.,"[2, 2, 7, 4, 1, 10]",26,"[1, 1, 2, 1, 1, 3]",9,0.0,1,2,2,3
"Little one, what is thy name?""","[6, 3, 4, 2, 3, 4]",22,"[1, 1, 1, 1, 1, 1]",6,-0.1875,9,2,2,3
said Petersen Sahib.,"[4, 8, 5]",17,"[1, 3, 2]",6,0.0,6,2,2,3
"Little Toomai was too frightened to speak, but Kala Nag was behind him, and Toomai made a sign with his hand, and the elephant caught him up in his trunk and held him level with Pudmini's forehead, in front of the great Petersen Sahib.","[6, 6, 3, 3, 10, 2, 5, 3, 4, 3, 3, 6, 3, 3, 6, 4, 1, 4, 4, 3, 4, 3, 3, 8, 6, 3, 2, 2, 3, 5, 3, 4, 3, 5, 4, 7, 2, 8, 2, 5, 2, 3, 5, 8, 5]",187,"[1, 2, 1, 1, 2, 1, 2, 1, 2, 1, 1, 2, 1, 1, 2, 1, 1, 1, 1, 1, 1, 1, 1, 3, 1, 1, 1, 1, 1, 1, 1, 1, 1, 2, 1, 3, 0, 4, 1, 1, 1, 1, 2, 3, 2]",62,0.0708333333333,15,1,1,4
"Then Little Toomai covered his face with his hands, for he was only a child, and except where elephants were concerned, he was just as bashful as a child could be.","[4, 6, 6, 7, 3, 4, 4, 3, 5, 3, 2, 3, 4, 1, 5, 3, 6, 5, 9, 4, 9, 2, 3, 4, 2, 7, 2, 1, 5, 5, 2]",129,"[1, 1, 2, 2, 1, 1, 1, 1, 1, 1, 1, 1, 2, 1, 1, 1, 2, 1, 3, 1, 2, 1, 1, 1, 1, 2, 1, 1, 1, 1, 1]",39,-0.09375,14,1,1,2
"""Oho!""",[3],3,[2],2,0.0,6,2,2,3
"said Petersen Sahib, smiling underneath his mustache, ""and why didst thou teach thy elephant that trick?","[4, 8, 5, 7, 10, 3, 8, 3, 3, 5, 4, 5, 3, 8, 4, 5]",85,"[1, 3, 2, 2, 4, 1, 2, 1, 1, 1, 1, 2, 1, 3, 1, 1]",27,0.0,16,2,2,2
"Was it to help thee steal green corn from the roofs of the houses when the ears are put out to dry?""","[3, 2, 2, 4, 4, 5, 5, 4, 4, 3, 5, 2, 3, 6, 4, 3, 4, 3, 3, 3, 2, 3]",77,"[1, 1, 1, 1, 1, 2, 1, 1, 1, 1, 1, 1, 1, 1, 1, 1, 2, 1, 1, 1, 1, 1]",24,-0.133333333333,11,2,2,2
"""Not green corn, Protector of the Poor,--melons,"" said Little Toomai, and all the men sitting about broke into a roar of laughter.","[3, 5, 4, 9, 2, 3, 4, 6, 4, 6, 6, 3, 3, 3, 3, 7, 5, 5, 4, 1, 4, 2, 8]",100,"[1, 1, 1, 3, 1, 1, 1, 2, 1, 1, 2, 1, 1, 1, 1, 2, 2, 1, 2, 1, 1, 1, 2]",31,-0.04375,14,2,2,2
Most of them had taught their elephants that trick when they were boys.,"[4, 2, 4, 3, 6, 5, 9, 4, 5, 4, 4, 4, 4]",58,"[1, 1, 1, 1, 1, 1, 3, 1, 1, 1, 1, 1, 1]",15,0.5,7,0,0,0
"Little Toomai was hanging eight feet up in the air, and he wished very much that he were eight feet underground.","[6, 6, 3, 7, 5, 4, 2, 2, 3, 3, 3, 2, 6, 4, 4, 4, 2, 4, 5, 4, 11]",90,"[1, 2, 1, 2, 1, 1, 1, 1, 1, 1, 1, 1, 1, 2, 1, 1, 1, 1, 1, 1, 3]",26,0.03625,14,2,2,2
"""He is Toomai, my son, Sahib,"" said Big Toomai, scowling.","[2, 2, 6, 2, 3, 5, 4, 3, 6, 8]",41,"[1, 1, 2, 1, 1, 2, 1, 1, 2, 2]",14,0.0,1,2,2,3
"""He is a very bad boy, and he will end in a jail, Sahib.""","[2, 2, 1, 4, 3, 3, 3, 2, 4, 3, 2, 1, 4, 5]",39,"[1, 1, 1, 2, 1, 1, 1, 1, 1, 1, 1, 1, 1, 2]",16,-0.505,4,2,2,1
"""Of that I have my doubts,"" said Petersen Sahib.","[2, 4, 1, 4, 2, 6, 4, 8, 5]",36,"[1, 1, 1, 1, 1, 1, 1, 3, 2]",12,0.0,1,2,2,3
"""A boy who can face a full Keddah at his age does not end in jails.","[1, 3, 3, 3, 4, 1, 4, 6, 2, 3, 3, 4, 3, 3, 2, 5]",50,"[1, 1, 1, 1, 1, 1, 1, 2, 1, 1, 1, 0, 1, 1, 1, 1]",16,0.35,17,0,0,0
"See, little one, here are four annas to spend in sweetmeats because thou hast a little head under that great thatch of hair.","[3, 6, 3, 4, 3, 4, 5, 2, 5, 2, 10, 7, 4, 4, 1, 6, 4, 5, 4, 5, 6, 2, 4]",99,"[1, 1, 1, 1, 1, 1, 2, 1, 1, 1, 3, 2, 1, 1, 1, 1, 2, 2, 1, 2, 1, 1, 1]",30,0.141666666667,8,2,2,2
"In time thou mayest become a hunter too.""","[2, 4, 4, 6, 6, 1, 6, 3]",32,"[1, 1, 1, 1, 2, 1, 2, 1]",10,0.0,1,2,2,3
Big Toomai scowled more than ever.,"[3, 6, 7, 4, 4, 4]",28,"[1, 2, 1, 1, 1, 2]",8,0.25,17,0,0,3
"""Remember, though, that Keddahs are not good for children to play in,"" Petersen Sahib went on.","[8, 6, 4, 7, 3, 3, 4, 3, 8, 2, 4, 2, 8, 5, 4, 2]",73,"[3, 1, 1, 2, 1, 1, 1, 1, 2, 1, 1, 1, 3, 2, 1, 1]",23,-0.35,11,2,2,1
"""Must I never go there, Sahib?""","[4, 1, 5, 2, 5, 5]",22,"[1, 1, 2, 1, 1, 2]",8,0.0,6,2,2,3
asked Little Toomai with a big gasp.,"[5, 6, 6, 4, 1, 3, 4]",29,"[1, 1, 2, 1, 1, 1, 1]",8,-0.09375,1,2,2,3
"""Yes.""",[3],3,[0],0,0.0,6,2,2,3
Petersen Sahib smiled again.,"[8, 5, 6, 5]",24,"[3, 2, 1, 2]",8,0.6,7,0,0,0
"""When thou hast seen the elephants dance.","[4, 4, 4, 4, 3, 9, 5]",33,"[1, 1, 1, 1, 1, 3, 1]",9,0.0,1,2,2,3
That is the proper time.,"[4, 2, 3, 6, 4]",19,"[1, 1, 1, 2, 1]",6,0.0,6,2,2,3
"Come to me when thou hast seen the elephants dance, and then I will let thee go into all the Keddahs.""","[4, 2, 2, 4, 4, 4, 4, 3, 9, 5, 3, 4, 1, 4, 3, 4, 2, 4, 3, 3, 7]",79,"[1, 1, 1, 1, 1, 1, 1, 1, 3, 1, 1, 1, 1, 1, 1, 1, 1, 2, 1, 1, 2]",25,0.0,16,2,2,2
"There was another roar of laughter, for that is an old joke among elephant-catchers, and it means just never.","[5, 3, 7, 4, 2, 8, 3, 4, 2, 2, 3, 4, 5, 17, 3, 2, 5, 4, 5]",88,"[1, 1, 3, 1, 1, 2, 1, 1, 1, 1, 1, 1, 2, 5, 1, 1, 2, 1, 2]",29,0.1,14,2,2,2
"There are great cleared flat places hidden away in the forests that are called elephants' ball-rooms, but even these are only found by accident, and no man has ever seen the elephants dance.","[5, 3, 5, 7, 4, 6, 6, 4, 2, 3, 7, 4, 3, 6, 9, 10, 3, 4, 5, 3, 4, 5, 2, 8, 3, 2, 3, 3, 4, 4, 3, 9, 5]",154,"[1, 1, 2, 2, 1, 1, 2, 2, 1, 1, 2, 1, 1, 1, 3, 2, 1, 2, 1, 1, 2, 1, 1, 3, 1, 1, 1, 1, 2, 1, 1, 3, 1]",48,0.152083333333,0,1,1,2
"When a driver boasts of his skill and bravery the other drivers say, ""And when didst thou see the elephants dance?""","[4, 1, 6, 6, 2, 3, 5, 3, 7, 3, 5, 7, 3, 3, 4, 5, 4, 3, 3, 9, 5]",91,"[1, 1, 2, 1, 1, 1, 1, 1, 3, 1, 2, 2, 1, 1, 1, 1, 1, 1, 1, 3, 1]",28,-0.125,11,2,2,2
"Kala Nag put Little Toomai down, and he bowed to the earth again and went away with his father, and gave the silver four-anna piece to his mother, who was nursing his baby brother, and they all were put up on Kala Nag's back, and the line of grunting, squealing elephants rolled down the hill path to the plains.","[4, 3, 3, 6, 6, 4, 3, 2, 5, 2, 3, 5, 5, 3, 4, 4, 4, 3, 6, 3, 4, 3, 6, 9, 5, 2, 3, 6, 3, 3, 7, 3, 4, 7, 3, 4, 3, 4, 3, 2, 2, 4, 3, 2, 4, 3, 3, 4, 2, 8, 9, 9, 6, 4, 3, 4, 4, 2, 3, 6]",247,"[2, 1, 1, 1, 2, 1, 1, 1, 1, 1, 1, 2, 2, 1, 1, 2, 1, 1, 2, 1, 1, 1, 2, 3, 2, 1, 1, 2, 1, 1, 2, 1, 2, 2, 1, 1, 1, 1, 1, 1, 1, 2, 1, 0, 1, 1, 1, 1, 1, 2, 3, 3, 1, 1, 1, 1, 1, 1, 1, 1]",79,-0.124652777778,18,1,1,4
"It was a very lively march on account of the new elephants, who gave trouble at every ford, and needed coaxing or beating every other minute.","[2, 3, 1, 4, 6, 5, 2, 7, 2, 3, 3, 9, 3, 4, 7, 2, 5, 4, 3, 6, 7, 2, 7, 5, 5, 6]",113,"[1, 1, 1, 2, 3, 1, 1, 2, 1, 1, 1, 3, 1, 1, 1, 1, 3, 1, 1, 1, 2, 1, 3, 3, 2, 2]",41,-0.00284090909091,14,1,1,2
"Big Toomai prodded Kala Nag spitefully, for he was very angry, but Little Toomai was too happy to speak.","[3, 6, 7, 4, 3, 10, 3, 2, 3, 4, 5, 3, 6, 6, 3, 3, 5, 2, 5]",83,"[1, 2, 1, 2, 1, 4, 1, 1, 1, 2, 2, 1, 1, 2, 1, 1, 2, 1, 2]",29,-0.009375,14,2,2,2
"Petersen Sahib had noticed him, and given him money, so he felt as a private soldier would feel if he had been called out of the ranks and praised by his commander-in-chief.","[8, 5, 3, 7, 3, 3, 5, 3, 5, 2, 2, 4, 2, 1, 7, 7, 5, 4, 2, 2, 3, 4, 6, 3, 2, 3, 5, 3, 7, 2, 3, 18]",139,"[3, 2, 1, 2, 1, 1, 2, 1, 2, 1, 1, 1, 1, 1, 2, 3, 1, 1, 1, 1, 1, 1, 1, 1, 1, 1, 1, 1, 1, 1, 1, 6]",46,0.0,0,1,1,2
"""What did Petersen Sahib mean by the elephant dance?""","[4, 3, 8, 5, 4, 2, 3, 8, 5]",42,"[1, 1, 3, 2, 2, 1, 1, 3, 1]",15,-0.3125,9,2,2,1
"he said, at last, softly to his mother.","[2, 4, 2, 4, 6, 2, 3, 6]",29,"[1, 1, 1, 1, 2, 1, 1, 2]",10,0.05,1,2,2,3
Big Toomai heard him and grunted.,"[3, 6, 5, 3, 3, 7]",27,"[1, 2, 2, 1, 1, 1]",8,0.0,6,2,2,3
"""That thou shouldst never be one of these hill buffaloes of trackers.","[4, 4, 8, 5, 2, 3, 2, 5, 4, 9, 2, 8]",56,"[1, 1, 1, 2, 1, 1, 1, 1, 1, 2, 1, 2]",15,0.0,1,2,2,3
That was what he meant.,"[4, 3, 4, 2, 5]",18,"[1, 1, 1, 1, 2]",6,0.0,6,2,2,3
"Oh, you in front, what is blocking the way?""","[2, 3, 2, 5, 4, 2, 8, 3, 3]",32,"[1, 1, 1, 1, 1, 1, 2, 1, 1]",10,0.0,1,2,2,3
"An Assamese driver, two or three elephants ahead, turned round angrily, crying: ""Bring up Kala Nag, and knock this youngster of mine into good behavior.","[2, 8, 6, 3, 2, 5, 9, 5, 6, 5, 7, 6, 5, 2, 4, 3, 3, 5, 4, 9, 2, 4, 4, 4, 8]",121,"[1, 3, 2, 1, 1, 1, 3, 3, 1, 1, 3, 1, 1, 1, 2, 1, 1, 1, 1, 2, 1, 1, 2, 1, 3]",39,0.1,0,1,1,2
Why should Petersen Sahib have chosen me to go down with you donkeys of the rice fields?,"[3, 6, 8, 5, 4, 6, 2, 2, 2, 4, 4, 3, 7, 2, 3, 4, 6]",71,"[1, 1, 3, 2, 1, 2, 1, 1, 1, 1, 1, 1, 2, 1, 1, 1, 2]",23,-0.155555555556,11,2,2,2
"Lay your beast alongside, Toomai, and let him prod with his tusks.","[3, 4, 5, 9, 6, 3, 3, 3, 4, 4, 3, 5]",52,"[1, 1, 2, 3, 2, 1, 1, 1, 1, 1, 1, 1]",16,0.0,1,2,2,3
"By all the Gods of the Hills, these new elephants are possessed, or else they can smell their companions in the jungle.""","[2, 3, 3, 4, 2, 3, 5, 5, 3, 9, 3, 9, 2, 4, 4, 3, 5, 5, 10, 2, 3, 6]",95,"[1, 1, 1, 1, 1, 1, 1, 1, 1, 3, 1, 2, 1, 1, 1, 1, 1, 1, 3, 1, 1, 1]",27,0.136363636364,8,2,2,2
"Kala Nag hit the new elephant in the ribs and knocked the wind out of him, as Big Toomai said, ""We have swept the hills of wild elephants at the last catch.","[4, 3, 3, 3, 3, 8, 2, 3, 4, 3, 7, 3, 4, 3, 2, 3, 2, 3, 6, 4, 2, 4, 5, 3, 5, 2, 4, 9, 2, 3, 4, 5]",121,"[2, 1, 1, 1, 1, 3, 1, 1, 1, 1, 1, 1, 1, 1, 1, 1, 1, 1, 2, 1, 1, 1, 1, 1, 1, 1, 1, 3, 1, 1, 1, 1]",38,0.0590909090909,14,1,1,2
It is only your carelessness in driving.,"[2, 2, 4, 4, 12, 2, 7]",33,"[1, 1, 2, 1, 4, 1, 2]",12,0.0,1,2,2,3
"Must I keep order along the whole line?""","[4, 1, 4, 5, 5, 3, 5, 4]",31,"[1, 1, 1, 2, 2, 1, 1, 1]",10,0.2,17,2,2,3
"""Hear him!""","[4, 3]",7,"[2, 1]",3,0.0,6,2,2,3
said the other driver.,"[4, 3, 5, 6]",18,"[1, 1, 2, 2]",6,-0.125,9,2,2,3
"""We have swept the hills!","[2, 4, 5, 3, 5]",19,"[1, 1, 1, 1, 1]",5,0.0,6,2,2,3
Ho!,[2],2,[1],1,0.0,6,2,2,3
Ho!,[2],2,[1],1,0.0,6,2,2,3
"You are very wise, you plains people.","[3, 3, 4, 4, 3, 6, 6]",29,"[1, 1, 2, 1, 1, 1, 1]",8,0.91,2,0,0,0
Anyone but a mud-head who never saw the jungle would know that they know that the drives are ended for the season.,"[6, 3, 1, 8, 3, 5, 3, 3, 6, 5, 4, 4, 4, 4, 4, 3, 6, 3, 5, 3, 3, 6]",92,"[2, 1, 1, 3, 1, 2, 1, 1, 1, 1, 1, 1, 1, 1, 1, 1, 1, 1, 1, 1, 1, 3]",28,0.0,14,2,2,2
"Therefore all the wild elephants to-night will--but why should I waste wisdom on a river-turtle?""","[9, 3, 3, 4, 9, 8, 4, 3, 3, 6, 1, 5, 6, 2, 1, 12]",79,"[3, 1, 1, 1, 3, 2, 1, 1, 1, 1, 1, 1, 2, 1, 1, 3]",24,-0.05,16,2,2,2
"""What will they do?""","[4, 4, 4, 2]",14,"[1, 1, 1, 1]",4,0.0,6,2,2,3
Little Toomai called out.,"[6, 6, 6, 3]",21,"[1, 2, 1, 1]",5,-0.1875,9,2,2,3
"""Ohe, little one.","[3, 6, 3]",12,"[1, 1, 1]",3,-0.1875,9,2,2,3
Art thou there?,"[3, 4, 5]",12,"[1, 1, 1]",3,0.0,6,2,2,3
"Well, I will tell thee, for thou hast a cool head.","[4, 1, 4, 4, 4, 3, 4, 4, 1, 4, 4]",37,"[1, 1, 1, 1, 1, 1, 1, 1, 1, 1, 2]",12,0.35,17,0,0,0
"They will dance, and it behooves thy father, who has swept all the hills of all the elephants, to double-chain his pickets to-night.""","[4, 4, 5, 3, 2, 8, 3, 6, 3, 3, 5, 3, 3, 5, 2, 3, 3, 9, 2, 12, 3, 7, 8]",106,"[1, 1, 1, 1, 1, 2, 1, 2, 1, 1, 1, 1, 1, 1, 1, 1, 1, 3, 1, 3, 1, 2, 2]",31,0.0,14,1,1,2
"""What talk is this?""","[4, 4, 2, 4]",14,"[1, 1, 1, 1]",4,0.0,6,2,2,3
said Big Toomai.,"[4, 3, 6]",13,"[1, 1, 2]",4,0.0,6,2,2,3
"""For forty years, father and son, we have tended elephants, and we have never heard such moonshine about dances.""","[3, 5, 5, 6, 3, 3, 2, 4, 6, 9, 3, 2, 4, 5, 5, 4, 9, 5, 6]",89,"[1, 2, 2, 2, 1, 1, 1, 1, 1, 3, 1, 1, 1, 2, 2, 1, 2, 2, 1]",28,0.0,14,2,2,2
"""Yes; but a plainsman who lives in a hut knows only the four walls of his hut.","[3, 3, 1, 9, 3, 5, 2, 1, 3, 5, 4, 3, 4, 5, 2, 3, 3]",59,"[0, 1, 1, 2, 1, 1, 1, 1, 1, 1, 2, 1, 1, 1, 1, 1, 1]",18,0.0,16,2,2,3
"Well, leave thy elephants unshackled tonight and see what comes.","[4, 5, 3, 9, 10, 7, 3, 3, 4, 5]",53,"[1, 2, 1, 3, 2, 2, 1, 1, 1, 1]",15,0.0,1,2,2,3
"As for their dancing, I have seen the place where--Bapree-bap!","[2, 3, 5, 7, 1, 4, 4, 3, 5, 5, 10]",49,"[1, 1, 1, 2, 1, 1, 1, 1, 1, 1, 3]",14,0.0,1,2,2,3
How many windings has the Dihang River?,"[3, 4, 8, 3, 3, 6, 5]",32,"[1, 2, 2, 1, 1, 2, 2]",11,0.5,7,0,0,0
"Here is another ford, and we must swim the calves.","[4, 2, 7, 4, 3, 2, 4, 4, 3, 6]",39,"[1, 1, 3, 1, 1, 1, 1, 1, 1, 1]",12,0.0,1,2,2,3
"Stop still, you behind there.""","[4, 5, 3, 6, 5]",23,"[1, 1, 1, 2, 1]",6,-0.4,4,2,2,1
"And in this way, talking and wrangling and splashing through the rivers, they made their first march to a sort of receiving camp for the new elephants.","[3, 2, 4, 3, 7, 3, 9, 3, 9, 7, 3, 6, 4, 4, 5, 5, 5, 2, 1, 4, 2, 9, 4, 3, 3, 3, 9]",122,"[1, 1, 1, 1, 2, 1, 2, 1, 2, 1, 1, 2, 1, 1, 1, 1, 1, 1, 1, 1, 1, 3, 1, 1, 1, 1, 3]",35,0.193181818182,8,1,1,2
But they lost their tempers long before they got there.,"[3, 4, 4, 5, 7, 4, 6, 4, 3, 5]",45,"[1, 1, 1, 1, 2, 1, 2, 1, 1, 1]",12,-0.05,1,2,2,3
"Then the elephants were chained by their hind legs to their big stumps of pickets, and extra ropes were fitted to the new elephants, and the fodder was piled before them, and the hill drivers went back to Petersen Sahib through the afternoon light, telling the plains drivers to be extra careful that night, and laughing when the plains drivers asked the reason.","[4, 3, 9, 4, 7, 2, 5, 4, 4, 2, 5, 3, 6, 2, 7, 3, 5, 5, 4, 6, 2, 3, 3, 9, 3, 3, 6, 3, 5, 6, 4, 3, 3, 4, 7, 4, 4, 2, 8, 5, 7, 3, 9, 5, 7, 3, 6, 7, 2, 2, 5, 7, 4, 5, 3, 8, 4, 3, 6, 7, 5, 3, 6]",294,"[1, 1, 3, 1, 1, 1, 1, 1, 1, 1, 1, 1, 1, 1, 2, 1, 2, 1, 1, 1, 1, 1, 1, 3, 1, 1, 2, 1, 1, 2, 1, 1, 1, 1, 2, 1, 1, 1, 3, 2, 1, 1, 3, 1, 2, 1, 1, 2, 1, 1, 2, 3, 1, 1, 1, 2, 1, 1, 1, 2, 1, 1, 3]",86,0.0623376623377,5,1,1,4
"Little Toomai attended to Kala Nag's supper, and as evening fell, wandered through the camp, unspeakably happy, in search of a tom-tom.","[6, 6, 8, 2, 4, 3, 2, 6, 3, 2, 7, 4, 8, 7, 3, 4, 11, 5, 2, 6, 2, 1, 7]",109,"[1, 2, 2, 1, 2, 1, 0, 2, 1, 1, 3, 1, 2, 1, 1, 1, 5, 2, 1, 2, 1, 1, 2]",36,0.30625,8,0,0,2
"When an Indian child's heart is full, he does not run about and make a noise in an irregular fashion.","[4, 2, 6, 5, 2, 5, 2, 4, 2, 4, 3, 3, 5, 3, 4, 1, 5, 2, 2, 9, 7]",80,"[1, 1, 3, 1, 0, 2, 1, 1, 1, 0, 1, 1, 2, 1, 1, 1, 1, 1, 1, 4, 2]",27,0.35,8,0,0,0
He sits down to a sort of revel all by himself.,"[2, 4, 4, 2, 1, 4, 2, 5, 3, 2, 7]",36,"[1, 1, 1, 1, 1, 1, 1, 2, 1, 1, 2]",13,-0.155555555556,9,2,2,3
And Little Toomai had been spoken to by Petersen Sahib!,"[3, 6, 6, 3, 4, 6, 2, 2, 8, 5]",45,"[1, 1, 2, 1, 1, 2, 1, 1, 3, 2]",15,-0.234375,9,2,2,3
"If he had not found what he wanted, I believe he would have been ill.","[2, 2, 3, 3, 5, 4, 2, 6, 1, 7, 2, 5, 4, 4, 3]",53,"[1, 1, 1, 1, 1, 1, 1, 1, 1, 3, 1, 1, 1, 1, 1]",17,-0.5,4,2,2,1
"But the sweetmeat seller in the camp lent him a little tom-tom--a drum beaten with the flat of the hand--and he sat down, cross-legged, before Kala Nag as the stars began to come out, the tom-tom in his lap, and he thumped and he thumped and he thumped, and the more he thought of the great honor that had been done to him, the more he thumped, all alone among the elephant fodder.","[3, 3, 9, 6, 2, 3, 4, 4, 3, 1, 6, 7, 1, 4, 6, 4, 3, 4, 2, 3, 4, 3, 2, 3, 4, 12, 6, 4, 3, 2, 3, 5, 5, 2, 4, 3, 3, 7, 2, 3, 3, 3, 2, 7, 3, 2, 7, 3, 2, 7, 3, 3, 4, 2, 7, 2, 3, 5, 5, 4, 3, 4, 4, 2, 3, 3, 4, 2, 7, 3, 5, 5, 3, 8, 6]",297,"[1, 1, 3, 2, 1, 1, 1, 1, 1, 1, 1, 2, 1, 1, 3, 1, 1, 1, 1, 1, 1, 1, 1, 1, 1, 2, 2, 2, 1, 1, 1, 1, 2, 1, 1, 1, 1, 2, 1, 1, 1, 1, 1, 1, 1, 1, 1, 1, 1, 1, 1, 1, 1, 1, 1, 1, 1, 2, 2, 1, 1, 1, 1, 1, 1, 1, 1, 1, 1, 1, 2, 2, 1, 3, 2]",93,0.238657407407,5,1,1,4
"There was no tune and no words, but the thumping made him happy.","[5, 3, 2, 4, 3, 2, 5, 3, 3, 8, 4, 3, 5]",50,"[1, 1, 1, 1, 1, 1, 1, 1, 1, 2, 1, 1, 2]",15,0.8,2,0,0,0
"The new elephants strained at their ropes, and squealed and trumpeted from time to time, and he could hear his mother in the camp hut putting his small brother to sleep with an old, old song about the great God Shiv, who once told all the animals what they should eat.","[3, 3, 9, 8, 2, 5, 5, 3, 8, 3, 9, 4, 4, 2, 4, 3, 2, 5, 4, 3, 6, 2, 3, 4, 3, 7, 3, 5, 7, 2, 5, 4, 2, 3, 3, 4, 5, 3, 5, 3, 4, 3, 4, 4, 3, 3, 7, 4, 4, 6, 3]",213,"[1, 1, 3, 1, 1, 1, 1, 1, 2, 1, 2, 1, 1, 1, 1, 1, 1, 1, 2, 1, 2, 1, 1, 1, 1, 2, 1, 1, 2, 1, 1, 1, 1, 1, 1, 1, 2, 1, 2, 1, 1, 1, 1, 1, 1, 1, 3, 1, 1, 1, 2]",64,0.177272727273,15,1,1,4
"It is a very soothing lullaby, and the first verse says:       Shiv, who poured the harvest and made the winds to blow,      Sitting at the doorways of a day of long ago,      Gave to each his portion, food and toil and fate,      From the King upon the guddee to the Beggar at the gate.","[2, 2, 1, 4, 8, 7, 3, 3, 5, 5, 4, 4, 3, 6, 3, 7, 3, 4, 3, 5, 2, 4, 7, 2, 3, 8, 2, 1, 3, 2, 4, 3, 4, 2, 4, 3, 7, 4, 3, 4, 3, 4, 4, 3, 4, 4, 3, 6, 2, 3, 6, 2, 3, 4]",205,"[1, 1, 1, 2, 2, 3, 1, 1, 1, 1, 1, 1, 1, 1, 1, 2, 1, 1, 1, 1, 1, 1, 2, 1, 1, 2, 1, 1, 1, 1, 1, 2, 1, 1, 2, 1, 2, 1, 1, 1, 1, 1, 1, 1, 1, 2, 1, 2, 1, 1, 2, 1, 1, 1]",67,0.133333333333,15,1,1,4
All things made he--Shiva the Preserver.,"[3, 6, 4, 2, 5, 3, 9]",32,"[1, 1, 1, 1, 2, 1, 3]",10,0.0,1,2,2,3
Mahadeo!,[7],7,[3],3,0.0,6,2,2,3
Mahadeo!,[7],7,[3],3,0.0,6,2,2,3
"He made all--      Thorn for the camel, fodder for the kine,      And mother's heart for sleepy head, O little son of mine!","[2, 4, 3, 5, 3, 3, 5, 6, 3, 3, 4, 3, 6, 2, 5, 3, 6, 4, 1, 6, 3, 2, 4]",86,"[1, 1, 1, 1, 1, 1, 2, 2, 1, 1, 1, 1, 2, 0, 2, 1, 2, 2, 1, 1, 1, 1, 1]",28,-0.234375,11,2,2,2
"Little Toomai came in with a joyous tunk-a-tunk at the end of each verse, till he felt sleepy and stretched himself on the fodder at Kala Nag's side.","[6, 6, 4, 2, 4, 1, 6, 11, 2, 3, 3, 2, 4, 5, 4, 2, 4, 6, 3, 9, 7, 2, 3, 6, 2, 4, 3, 2, 4]",120,"[1, 2, 1, 1, 1, 1, 1, 3, 1, 1, 1, 1, 2, 1, 1, 1, 1, 2, 1, 1, 2, 1, 1, 2, 1, 2, 1, 0, 1]",36,-0.11875,14,1,1,2
"At last the elephants began to lie down one after another as is their custom, till only Kala Nag at the right of the line was left standing up; and he rocked slowly from side to side, his ears put forward to listen to the night wind as it blew very slowly across the hills.","[2, 4, 3, 9, 5, 2, 3, 4, 3, 5, 7, 2, 2, 5, 6, 4, 4, 4, 3, 2, 3, 5, 2, 3, 4, 3, 4, 8, 2, 3, 2, 6, 6, 4, 4, 2, 4, 3, 4, 3, 7, 2, 6, 2, 3, 5, 4, 2, 2, 4, 4, 6, 6, 3, 5]",215,"[1, 1, 1, 3, 2, 1, 1, 1, 1, 2, 3, 1, 1, 1, 2, 1, 2, 2, 1, 1, 1, 1, 1, 1, 1, 1, 1, 2, 1, 1, 1, 1, 2, 1, 1, 1, 1, 1, 2, 1, 2, 1, 2, 1, 1, 1, 1, 1, 1, 1, 2, 2, 2, 1, 1]",72,-0.079977324263,18,1,1,4
